route_id,stop_name,month,on time,late,early,route_short_name,route_long_name
T5718,KJ386 KOMERSIAL TAMING JAYA,2026-02,7,0,0,T571,Stesen KTM Serdang ~ Taman Sri Pulai
T5718,KJ699 KOMERSIAL TAMING JAYA,2026-02,6,0,0,T571,Stesen KTM Serdang ~ Taman Sri Pulai
T5718,KJ700 SHELL TAMING JAYA,2026-02,5,0,0,T571,Stesen KTM Serdang ~ Taman Sri Pulai
T5718,KJ701 WISMA TANJUNG BALAI,2026-02,4,0,0,T571,Stesen KTM Serdang ~ Taman Sri Pulai
T5718,KJ706 KOMERSIAL TAMAN DESA SERDANG,2026-02,2,0,2,T571,Stesen KTM Serdang ~ Taman Sri Pulai
T5718,KJ740 TAMAN BUKIT BELIMBING (OPP),2026-02,2,0,0,T571,Stesen KTM Serdang ~ Taman Sri Pulai
T5718,SJ597 SK TAMAN SG BESI INDAH,2026-02,2,0,2,T571,Stesen KTM Serdang ~ Taman Sri Pulai
T5800,(M) KL1311 ENDAH PROMENADE,2026-02,2,0,0,T580,Stesen LRT Awan Besar ~ TPM via Stesen LRT Bukit Jalil
T5800,KL1291 KM1 BUKIT JALIL,2026-02,2,0,0,T580,Stesen LRT Awan Besar ~ TPM via Stesen LRT Bukit Jalil
T5800,KL1293 APARTMENT ARENA GREEN,2026-02,2,0,0,T580,Stesen LRT Awan Besar ~ TPM via Stesen LRT Bukit Jalil
T5800,KL1299 APARTMENT ARENA GREEN (OPP),2026-02,2,0,0,T580,Stesen LRT Awan Besar ~ TPM via Stesen LRT Bukit Jalil
T5800,"KL1306 ZON J, BANDAR BARU SRI PETALING (UTARA)",2026-02,2,0,0,T580,Stesen LRT Awan Besar ~ TPM via Stesen LRT Bukit Jalil
T5800,"KL1307 ZON H, BANDAR BARU SRI PETALING (UTARA)",2026-02,2,0,0,T580,Stesen LRT Awan Besar ~ TPM via Stesen LRT Bukit Jalil
T5800,"KL1308 ZON G, SRI PETALING (TIMUR)",2026-02,1,0,0,T580,Stesen LRT Awan Besar ~ TPM via Stesen LRT Bukit Jalil
T5800,KL1310 ENDAH RIA CONDOMINIUM,2026-02,2,0,0,T580,Stesen LRT Awan Besar ~ TPM via Stesen LRT Bukit Jalil
T5800,KL1312 ENDAH PARADE,2026-02,0,0,1,T580,Stesen LRT Awan Besar ~ TPM via Stesen LRT Bukit Jalil
T5800,KL1313 BANK ISLAM SRI PETALING,2026-02,2,0,0,T580,Stesen LRT Awan Besar ~ TPM via Stesen LRT Bukit Jalil
T5800,KL1320 ENDAH VILLA CONDOMINIUM,2026-02,1,2,0,T580,Stesen LRT Awan Besar ~ TPM via Stesen LRT Bukit Jalil
T5800,KL1321 APT SRI ENDAH (OPP),2026-02,2,0,0,T580,Stesen LRT Awan Besar ~ TPM via Stesen LRT Bukit Jalil
T5800,KL1322 APT TAMAN SRI ENDAH,2026-02,1,0,0,T580,Stesen LRT Awan Besar ~ TPM via Stesen LRT Bukit Jalil
T5800,KL149 LRT BKT JALIL,2026-02,2,0,0,T580,Stesen LRT Awan Besar ~ TPM via Stesen LRT Bukit Jalil
T5800,KL151 LRT BKT JALIL,2026-02,2,0,0,T580,Stesen LRT Awan Besar ~ TPM via Stesen LRT Bukit Jalil
T5800,KL1540 ASTRO TPM,2026-02,2,0,0,T580,Stesen LRT Awan Besar ~ TPM via Stesen LRT Bukit Jalil
T5800,KL1542 ENTERPRISE 3 TPM,2026-02,2,0,0,T580,Stesen LRT Awan Besar ~ TPM via Stesen LRT Bukit Jalil
T5800,KL1550 I SHOPPE TPM,2026-02,2,0,0,T580,Stesen LRT Awan Besar ~ TPM via Stesen LRT Bukit Jalil
T5800,KL1551 MAYBANK TPM,2026-02,2,0,0,T580,Stesen LRT Awan Besar ~ TPM via Stesen LRT Bukit Jalil
T5800,KL1743 GREEN AVENUE CONDOMINIUM,2026-02,0,0,2,T580,Stesen LRT Awan Besar ~ TPM via Stesen LRT Bukit Jalil
T5800,KL2007 ENTERPRISE 3 TPM,2026-02,2,0,0,T580,Stesen LRT Awan Besar ~ TPM via Stesen LRT Bukit Jalil
T5800,KL2008 MAXIS TOC TPM,2026-02,2,0,0,T580,Stesen LRT Awan Besar ~ TPM via Stesen LRT Bukit Jalil
T5800,KL2009 TPM CARPARK,2026-02,2,0,0,T580,Stesen LRT Awan Besar ~ TPM via Stesen LRT Bukit Jalil
T5800,KL2010 MAXIS TOC TPM,2026-02,0,0,2,T580,Stesen LRT Awan Besar ~ TPM via Stesen LRT Bukit Jalil
T5800,KL2018 CALVARY CONVENTION CENTRE,2026-02,2,0,0,T580,Stesen LRT Awan Besar ~ TPM via Stesen LRT Bukit Jalil
T5800,KL2019 ANJUNG HIJAU GREENFIELDS,2026-02,2,0,0,T580,Stesen LRT Awan Besar ~ TPM via Stesen LRT Bukit Jalil
T5800,KL2020 AFC (OPP),2026-02,2,0,0,T580,Stesen LRT Awan Besar ~ TPM via Stesen LRT Bukit Jalil
T5800,KL2026 AURORA PLACE,2026-02,2,0,0,T580,Stesen LRT Awan Besar ~ TPM via Stesen LRT Bukit Jalil
T5800,KL2027 DEWAN SRI ENDAH,2026-02,1,0,0,T580,Stesen LRT Awan Besar ~ TPM via Stesen LRT Bukit Jalil
T5800,KL2028 FLAT SRI ENDAH,2026-02,1,0,0,T580,Stesen LRT Awan Besar ~ TPM via Stesen LRT Bukit Jalil
T5800,KL2029 8 PETALING CONDOMINIUM,2026-02,2,0,0,T580,Stesen LRT Awan Besar ~ TPM via Stesen LRT Bukit Jalil
T5800,KL2031 KOMERSIAL SRI PETALING,2026-02,2,0,0,T580,Stesen LRT Awan Besar ~ TPM via Stesen LRT Bukit Jalil
T5800,PAVILION BUKIT JALIL,2026-02,2,0,0,T580,Stesen LRT Awan Besar ~ TPM via Stesen LRT Bukit Jalil
T5810,(M) SJ362 LRT ALAM SUTERA,2026-02,0,0,11,T581,Stesen LRT Alam Sutera ~ PPR Pinggiran Bukit Jalil
T5810,(M) SJ368 PERUMAHAN MELODY (OPP),2026-02,9,0,0,T581,Stesen LRT Alam Sutera ~ PPR Pinggiran Bukit Jalil
T5810,GIANT BK (OPP),2026-02,7,0,4,T581,Stesen LRT Alam Sutera ~ PPR Pinggiran Bukit Jalil
T5810,KL2012 PPR PINGGIRAN BUKIT JALIL,2026-02,0,5,0,T581,Stesen LRT Alam Sutera ~ PPR Pinggiran Bukit Jalil
T5810,KL2015 PPR PINGGIRAN BUKIT JALIL,2026-02,3,0,0,T581,Stesen LRT Alam Sutera ~ PPR Pinggiran Bukit Jalil
T5810,KL2016 TAMAN LTAT,2026-02,11,0,0,T581,Stesen LRT Alam Sutera ~ PPR Pinggiran Bukit Jalil
T5810,PARAGON HEIGHTS,2026-02,7,0,1,T581,Stesen LRT Alam Sutera ~ PPR Pinggiran Bukit Jalil
T5810,SJ363 TRINITY GROUP,2026-02,9,0,0,T581,Stesen LRT Alam Sutera ~ PPR Pinggiran Bukit Jalil
T5810,SJ366 KINRARA GOLF CLUB,2026-02,9,0,0,T581,Stesen LRT Alam Sutera ~ PPR Pinggiran Bukit Jalil
T5810,SJ367 PERUMAHAN HENING (OPP),2026-02,3,0,0,T581,Stesen LRT Alam Sutera ~ PPR Pinggiran Bukit Jalil
T5810,SJ369 MELODY KINRARA (OPP),2026-02,6,0,0,T581,Stesen LRT Alam Sutera ~ PPR Pinggiran Bukit Jalil
T5810,SJ370 SIMFONI KINRARA,2026-02,3,0,0,T581,Stesen LRT Alam Sutera ~ PPR Pinggiran Bukit Jalil
T5810,SJ371 PANGSAPURI ENGGANG (OPP),2026-02,5,0,0,T581,Stesen LRT Alam Sutera ~ PPR Pinggiran Bukit Jalil
T5810,SJ390 PERUMAHAN BK 5,2026-02,9,0,0,T581,Stesen LRT Alam Sutera ~ PPR Pinggiran Bukit Jalil
T5810,SJ391 SMK SEKSYEN 3 BK (OPP),2026-02,12,0,0,T581,Stesen LRT Alam Sutera ~ PPR Pinggiran Bukit Jalil
T5810,SJ392 PERUMAHAN HARMONY (OPP),2026-02,6,0,0,T581,Stesen LRT Alam Sutera ~ PPR Pinggiran Bukit Jalil
T5810,SJ393 PERUMAHAN PERMAI,2026-02,9,0,0,T581,Stesen LRT Alam Sutera ~ PPR Pinggiran Bukit Jalil
T5810,SJ394 IPD SUBANG JAYA,2026-02,9,0,0,T581,Stesen LRT Alam Sutera ~ PPR Pinggiran Bukit Jalil
T5810,SJ396 SMK SEKSYEN 4 BK,2026-02,10,1,0,T581,Stesen LRT Alam Sutera ~ PPR Pinggiran Bukit Jalil
T6000,APARTMENT KENANGA & AKASIA,2026-02,16,0,0,T600,Stesen LRT IOI Puchong ~ Taman Wawasan
T6000,PANGSAPURI SRI SERAKA,2026-02,9,0,0,T600,Stesen LRT IOI Puchong ~ Taman Wawasan
T6000,SJ421 TAMAN WAWASAN,2026-02,9,0,0,T600,Stesen LRT IOI Puchong ~ Taman Wawasan
T6000,SJ427 PANGSAPURI PERMATA SARI,2026-02,12,0,0,T600,Stesen LRT IOI Puchong ~ Taman Wawasan
T6000,SJ428 PANGSAPURI DESA TANJUNG (OPP),2026-02,9,0,0,T600,Stesen LRT IOI Puchong ~ Taman Wawasan
T6000,SJ429 SK PUSAT BANDAR PUCHONG,2026-02,0,0,9,T600,Stesen LRT IOI Puchong ~ Taman Wawasan
T6000,SJ435 WAWASAN 1,2026-02,1,0,14,T600,Stesen LRT IOI Puchong ~ Taman Wawasan
T6000,SJ440 KIARA APARTMENT,2026-02,10,0,0,T600,Stesen LRT IOI Puchong ~ Taman Wawasan
T6000,SJ447 SKYPOD RESIDENCE,2026-02,2,0,13,T600,Stesen LRT IOI Puchong ~ Taman Wawasan
T6000,SJ449 SETIA WALK,2026-02,14,1,2,T600,Stesen LRT IOI Puchong ~ Taman Wawasan
T6000,SJ450 SETIA WALK (UTARA),2026-02,9,0,0,T600,Stesen LRT IOI Puchong ~ Taman Wawasan
T6000,SJ463 PANGSAPURI SRI BEGONIA,2026-02,14,0,0,T600,Stesen LRT IOI Puchong ~ Taman Wawasan
T6000,SJ464 PANGSAPURI SRI CAMELIA,2026-02,15,0,0,T600,Stesen LRT IOI Puchong ~ Taman Wawasan
T6000,SJ516 LOTUS EXTRA PUCHONG,2026-02,4,0,5,T600,Stesen LRT IOI Puchong ~ Taman Wawasan
T6000,SJ610 IOI MALL PUCHONG,2026-02,4,0,1,T600,Stesen LRT IOI Puchong ~ Taman Wawasan
T6000,SJ663 SRI PENAGA APARTMENT,2026-02,1,0,8,T600,Stesen LRT IOI Puchong ~ Taman Wawasan
T6000,SRI CASSIA & CASA PUTERI CONDOMINIUM,2026-02,13,0,0,T600,Stesen LRT IOI Puchong ~ Taman Wawasan
T6010,SJ237 TERMINAL PUCHONG UTAMA,2026-02,0,0,3,T601,Puchong Utama ~ Puchong Prima
T6010,SJ238 TAMAN PUCHONG UTAMA 12,2026-02,8,0,0,T601,Puchong Utama ~ Puchong Prima
T6010,SJ239 SK PUCHONG UTAMA 1 (OPP),2026-02,8,0,0,T601,Puchong Utama ~ Puchong Prima
T6010,SJ240 TAMAN PUCHONG UTAMA 10 (TIMUR),2026-02,6,0,0,T601,Puchong Utama ~ Puchong Prima
T6010,SJ241 TAMAN PUCHONG UTAMA 10 (TIMUR),2026-02,6,0,0,T601,Puchong Utama ~ Puchong Prima
T6010,SJ242 TAMAN PUCHONG UTAMA 10 (SELATAN),2026-02,6,0,0,T601,Puchong Utama ~ Puchong Prima
T6010,SJ243 TAMAN PUCHONG UTAMA (SELATAN),2026-02,8,0,0,T601,Puchong Utama ~ Puchong Prima
T6010,SJ244 TAMAN PUCHONG UTAMA 8,2026-02,6,0,0,T601,Puchong Utama ~ Puchong Prima
T6010,SJ261 TAMAN PUCHONG UTAMA 6,2026-02,7,0,0,T601,Puchong Utama ~ Puchong Prima
T6010,SJ263 TAMAN PERINDUSTRIAN MAJU JAYA,2026-02,8,0,0,T601,Puchong Utama ~ Puchong Prima
T6010,SJ277 PANGSAPURI AMAN,2026-02,3,0,0,T601,Puchong Utama ~ Puchong Prima
T6010,SJ280 PANGSAPURI LILI (OPP),2026-02,4,0,0,T601,Puchong Utama ~ Puchong Prima
T6010,SJ281 DESA IMPIANA,2026-02,5,0,0,T601,Puchong Utama ~ Puchong Prima
T6010,SJ282 LRT PUCHONG PRIMA,2026-02,5,0,1,T601,Puchong Utama ~ Puchong Prima
T6010,SJ283 FLAT PUCHONG PRIMA A14,2026-02,8,0,0,T601,Puchong Utama ~ Puchong Prima
T6010,SJ284 FLAT PUCHONG PRIMA A35,2026-02,8,0,0,T601,Puchong Utama ~ Puchong Prima
T6010,SJ285 PERMAI COURT PUCHONG PERDANA (OPP),2026-02,8,0,0,T601,Puchong Utama ~ Puchong Prima
T6010,SJ286 FLAT PUCHONG PERDANA (OPP),2026-02,8,0,0,T601,Puchong Utama ~ Puchong Prima
T6010,SJ299 LRT PUCHONG PERDANA,2026-02,8,0,0,T601,Puchong Utama ~ Puchong Prima
T6010,SJ303 BALAI MASYARAKAT PUCHONG PERDANA (OPP),2026-02,8,0,0,T601,Puchong Utama ~ Puchong Prima
T6010,SJ304 TAMAN PERINDUSTRIAN PUCHONG UTAMA (UTARA),2026-02,5,0,0,T601,Puchong Utama ~ Puchong Prima
T6010,SJ305 TAMAN PERINDUSTRIAN PUCHONG UTAMA (SELATAN),2026-02,4,0,0,T601,Puchong Utama ~ Puchong Prima
T6010,SJ670 PUCHONG PRIMA SEKSYEN 2,2026-02,8,0,0,T601,Puchong Utama ~ Puchong Prima
T6010,SJ674 TAMAN MAJU JAYA,2026-02,5,0,3,T601,Puchong Utama ~ Puchong Prima
T6030,(M) KOMERSIAL TAMAN PUTRA PERMAI,2026-02,5,1,0,T603,Stesen LRT Puchong Prima ~ Taman Mas Sepang
T6030,KOMERSIAL TAMAN PUTRA PERMAI,2026-02,3,0,0,T603,Stesen LRT Puchong Prima ~ Taman Mas Sepang
T6030,SJ273 SMK PUCHONG PERMAI,2026-02,4,0,0,T603,Stesen LRT Puchong Prima ~ Taman Mas Sepang
T6030,SJ274 PANGSAPURI LILI,2026-02,5,0,0,T603,Stesen LRT Puchong Prima ~ Taman Mas Sepang
T6030,SJ275 PANGSAPURI MELUR,2026-02,3,0,0,T603,Stesen LRT Puchong Prima ~ Taman Mas Sepang
T6030,SJ277 PANGSAPURI AMAN,2026-02,3,0,0,T603,Stesen LRT Puchong Prima ~ Taman Mas Sepang
T6030,SJ278 PANGSAPURI AMAN (OPP),2026-02,5,0,0,T603,Stesen LRT Puchong Prima ~ Taman Mas Sepang
T6030,SJ279 PPMU PUCHONG PERDANA,2026-02,0,0,6,T603,Stesen LRT Puchong Prima ~ Taman Mas Sepang
T6030,SJ280 PANGSAPURI LILI (OPP),2026-02,3,0,0,T603,Stesen LRT Puchong Prima ~ Taman Mas Sepang
T6030,SJ281 DESA IMPIANA,2026-02,2,0,0,T603,Stesen LRT Puchong Prima ~ Taman Mas Sepang
T6030,SJ282 LRT PUCHONG PRIMA,2026-02,2,0,0,T603,Stesen LRT Puchong Prima ~ Taman Mas Sepang
T6030,SP242 CALISA RESIDENCE,2026-02,4,0,0,T603,Stesen LRT Puchong Prima ~ Taman Mas Sepang
T6030,TAMAN PUCHONG TEKALI,2026-02,2,1,0,T603,Stesen LRT Puchong Prima ~ Taman Mas Sepang
T6030,TAMAN PUTRA PRIMA 2B,2026-02,5,0,1,T603,Stesen LRT Puchong Prima ~ Taman Mas Sepang
T6040,(M) SJ310 APARTMENT SRI TANJUNG,2026-02,9,0,0,T604,Stesen LRT Perindustrian Puchong ~ Taman Kinrara
T6040,SJ319 TAMAN KINRARA SEKSYEN 4,2026-02,10,1,0,T604,Stesen LRT Perindustrian Puchong ~ Taman Kinrara
T6040,SJ320 PANGSAPURI SURIA (OPP),2026-02,9,0,0,T604,Stesen LRT Perindustrian Puchong ~ Taman Kinrara
T6040,SJ321 APARTMENT KINRARA (OPP),2026-02,11,0,0,T604,Stesen LRT Perindustrian Puchong ~ Taman Kinrara
T6040,SJ322 TAMAN MAWAR,2026-02,12,0,0,T604,Stesen LRT Perindustrian Puchong ~ Taman Kinrara
T6040,SJ323 JASMINE COURT,2026-02,12,0,0,T604,Stesen LRT Perindustrian Puchong ~ Taman Kinrara
T6040,SJ324 SMK BATU 8,2026-02,11,0,0,T604,Stesen LRT Perindustrian Puchong ~ Taman Kinrara
T6040,SJ326 PERUMAHAN BELATOK 5,2026-02,10,0,0,T604,Stesen LRT Perindustrian Puchong ~ Taman Kinrara
T6040,SJ328 APARTMENT SRI ANGGERIK 2 (OPP),2026-02,10,0,0,T604,Stesen LRT Perindustrian Puchong ~ Taman Kinrara
T6040,SJ329 APARTMENT SRI ANGGERIK (OPP),2026-02,10,0,0,T604,Stesen LRT Perindustrian Puchong ~ Taman Kinrara
T6040,SJ335 APARTMENT VISTA LAVENDER,2026-02,9,0,1,T604,Stesen LRT Perindustrian Puchong ~ Taman Kinrara
T6040,SJ346 TAMAN PAIK SIONG,2026-02,5,1,0,T604,Stesen LRT Perindustrian Puchong ~ Taman Kinrara
T6040,SJ347 TUDM KINRARA,2026-02,10,0,0,T604,Stesen LRT Perindustrian Puchong ~ Taman Kinrara
T6040,SJ447 SKYPOD RESIDENCE,2026-02,10,1,0,T604,Stesen LRT Perindustrian Puchong ~ Taman Kinrara
T6040,SJ449 SETIA WALK,2026-02,11,0,0,T604,Stesen LRT Perindustrian Puchong ~ Taman Kinrara
T6040,SJ654 TAMAN KINRARA SEKSYEN 1,2026-02,5,0,0,T604,Stesen LRT Perindustrian Puchong ~ Taman Kinrara
T6040,SJ738 TAMAN MUTIARA PUCHONG (TIMUR),2026-02,10,0,0,T604,Stesen LRT Perindustrian Puchong ~ Taman Kinrara
T6040,SJ739 TAMAN MUTIARA PUCHONG (BARAT),2026-02,10,0,0,T604,Stesen LRT Perindustrian Puchong ~ Taman Kinrara
T6040,SJ740 TAMAN PERINDUSTRIAN PUCHONG,2026-02,8,0,0,T604,Stesen LRT Perindustrian Puchong ~ Taman Kinrara
T6040,SJ741 TAMAN SRI PUCHONG (UTARA),2026-02,8,0,0,T604,Stesen LRT Perindustrian Puchong ~ Taman Kinrara
T6040,SJ742 SURAU ALHIDAYAH,2026-02,5,0,0,T604,Stesen LRT Perindustrian Puchong ~ Taman Kinrara
T6040,SJ743 TAMAN SRI PUCHONG (TENGAH),2026-02,5,0,0,T604,Stesen LRT Perindustrian Puchong ~ Taman Kinrara
T6040,SJ744 TAMAN SRI PUCHONG (SELATAN),2026-02,7,0,0,T604,Stesen LRT Perindustrian Puchong ~ Taman Kinrara
T6040,SJ745 PANGSAPURI DESA IMPIAN (OPP),2026-02,7,0,0,T604,Stesen LRT Perindustrian Puchong ~ Taman Kinrara
T6040,SJ746 POS LAJU PUCHONG (OPP),2026-02,7,0,0,T604,Stesen LRT Perindustrian Puchong ~ Taman Kinrara
T6040,SJ747 KOMPLEKS INDUSTRI PUCHONG,2026-02,5,0,0,T604,Stesen LRT Perindustrian Puchong ~ Taman Kinrara
T6040,SJ749 LRT PERINDUSTRIAN PUCHONG,2026-02,0,0,5,T604,Stesen LRT Perindustrian Puchong ~ Taman Kinrara
T6050,APARTMENT KENANGA & AKASIA,2026-02,6,0,0,T605,Stesen LRT Bandar Puteri ~ Taman Wawasan
T6050,PANGSAPURI SRI ALPINIA,2026-02,9,0,0,T605,Stesen LRT Bandar Puteri ~ Taman Wawasan
T6050,SJ427 PANGSAPURI PERMATA SARI,2026-02,2,0,0,T605,Stesen LRT Bandar Puteri ~ Taman Wawasan
T6050,SJ428 PANGSAPURI DESA TANJUNG (OPP),2026-02,4,0,0,T605,Stesen LRT Bandar Puteri ~ Taman Wawasan
T6050,SJ429 SK PUSAT BANDAR PUCHONG,2026-02,4,0,0,T605,Stesen LRT Bandar Puteri ~ Taman Wawasan
T6050,SJ435 WAWASAN 1,2026-02,6,0,0,T605,Stesen LRT Bandar Puteri ~ Taman Wawasan
T6050,SJ440 KIARA APARTMENT,2026-02,4,0,0,T605,Stesen LRT Bandar Puteri ~ Taman Wawasan
T6050,SJ441 PERUMAHAN WAWASAN 2,2026-02,5,0,0,T605,Stesen LRT Bandar Puteri ~ Taman Wawasan
T6050,SJ452 HOSPITAL COLUMBIA PUCHONG,2026-02,6,0,0,T605,Stesen LRT Bandar Puteri ~ Taman Wawasan
T6050,SJ456 BANDAR PUTERI 10,2026-02,9,0,0,T605,Stesen LRT Bandar Puteri ~ Taman Wawasan
T6050,SJ457 BANDAR PUTERI (TIMUR),2026-02,9,0,0,T605,Stesen LRT Bandar Puteri ~ Taman Wawasan
T6050,SJ459 BANDAR PUTERI (TENGAH),2026-02,10,0,0,T605,Stesen LRT Bandar Puteri ~ Taman Wawasan
T6050,SJ460 PETRONAS BANDAR PUTERI,2026-02,10,0,0,T605,Stesen LRT Bandar Puteri ~ Taman Wawasan
T6050,SJ470 SERENA TERRACE HOUSE,2026-02,10,0,0,T605,Stesen LRT Bandar Puteri ~ Taman Wawasan
T6050,SJ478 GIANT BANDAR PUTERI PUCHONG (OPP),2026-02,2,0,3,T605,Stesen LRT Bandar Puteri ~ Taman Wawasan
T6050,SJ479 PERINDUSTRIAN BUKIT PUCHONG,2026-02,5,0,0,T605,Stesen LRT Bandar Puteri ~ Taman Wawasan
T6050,SJ480 KOI TROPIKA CONDOMINIUM,2026-02,8,0,0,T605,Stesen LRT Bandar Puteri ~ Taman Wawasan
T6050,SJ481 KG PASIR PUCHONG,2026-02,8,0,0,T605,Stesen LRT Bandar Puteri ~ Taman Wawasan
T6050,SJ661 PANGSAPURI SRI PINANG/SJKC KHENG CHEE,2026-02,3,0,0,T605,Stesen LRT Bandar Puteri ~ Taman Wawasan
T6050,"SJ704 SERI JATI, PUCHONG HARTAMAS",2026-02,9,0,0,T605,Stesen LRT Bandar Puteri ~ Taman Wawasan
T6050,SJ706 PANGSAPURI SERI JATI,2026-02,9,0,0,T605,Stesen LRT Bandar Puteri ~ Taman Wawasan
T6050,SJ711 KIM CREST,2026-02,9,0,0,T605,Stesen LRT Bandar Puteri ~ Taman Wawasan
T6050,SJ712 PUTERI HILLS,2026-02,10,0,0,T605,Stesen LRT Bandar Puteri ~ Taman Wawasan
T6050,SRI CASSIA & CASA PUTERI CONDOMINIUM,2026-02,6,0,0,T605,Stesen LRT Bandar Puteri ~ Taman Wawasan
T6050,THE CUBE,2026-02,5,0,0,T605,Stesen LRT Bandar Puteri ~ Taman Wawasan
T6400,(M) PJ124 SRI MANJA SQUARE,2026-02,6,0,0,T640,Stesen LRT Taman Jaya ~ Taman Sri Sentosa
T6400,(M) PJ126 HAB BAS SERI MANJA,2026-02,7,0,0,T640,Stesen LRT Taman Jaya ~ Taman Sri Sentosa
T6400,(M) PJ469 TERMINAL BAS,2026-02,8,0,0,T640,Stesen LRT Taman Jaya ~ Taman Sri Sentosa
T6400,KL1367 BOMBA KLANG LAMA (OPP),2026-02,10,0,0,T640,Stesen LRT Taman Jaya ~ Taman Sri Sentosa
T6400,KL1368 TAMAN SERI SENTOSA (TIMUR),2026-02,11,0,0,T640,Stesen LRT Taman Jaya ~ Taman Sri Sentosa
T6400,KL1369 AVENUE COURT,2026-02,9,1,0,T640,Stesen LRT Taman Jaya ~ Taman Sri Sentosa
T6400,KL1370 APT SERI SENTOSA AC4 (OPP),2026-02,10,0,0,T640,Stesen LRT Taman Jaya ~ Taman Sri Sentosa
T6400,KL1371 APT SERI SENTOSA (OPP),2026-02,0,0,9,T640,Stesen LRT Taman Jaya ~ Taman Sri Sentosa
T6400,KL1372 1K TRICOURT,2026-02,8,0,0,T640,Stesen LRT Taman Jaya ~ Taman Sri Sentosa
T6400,KL1373 SURAU NURUL IMAN (OPP),2026-02,7,0,0,T640,Stesen LRT Taman Jaya ~ Taman Sri Sentosa
T6400,KL1374 BAYVIEW COURT ID,2026-02,6,0,0,T640,Stesen LRT Taman Jaya ~ Taman Sri Sentosa
T6400,KL1381 APT PINANG 1A SERI SENTOSA,2026-02,9,0,0,T640,Stesen LRT Taman Jaya ~ Taman Sri Sentosa
T6400,KL1382 APT PINANG BLOK 13,2026-02,8,0,0,T640,Stesen LRT Taman Jaya ~ Taman Sri Sentosa
T6400,KL1383 FLAT TAMAN SERI SENTOSA,2026-02,8,0,0,T640,Stesen LRT Taman Jaya ~ Taman Sri Sentosa
T6400,PJ129 PANGSAPURI PERMAI (OPP),2026-02,7,0,0,T640,Stesen LRT Taman Jaya ~ Taman Sri Sentosa
T6400,PJ411 APT INAI COURT (OPP),2026-02,6,3,0,T640,Stesen LRT Taman Jaya ~ Taman Sri Sentosa
T6400,PJ412 APT INAI COURT,2026-02,3,0,0,T640,Stesen LRT Taman Jaya ~ Taman Sri Sentosa
T6400,PJ413 UITM PJ (OPP),2026-02,4,0,0,T640,Stesen LRT Taman Jaya ~ Taman Sri Sentosa
T6400,PJ415 TERMINAL BAS (OPP),2026-02,4,0,0,T640,Stesen LRT Taman Jaya ~ Taman Sri Sentosa
T6400,PJ416 PASAR PJ OLD TOWN (OPP),2026-02,0,0,3,T640,Stesen LRT Taman Jaya ~ Taman Sri Sentosa
T6400,PJ417 SEKSYEN 51 (SELATAN),2026-02,2,0,0,T640,Stesen LRT Taman Jaya ~ Taman Sri Sentosa
T6400,PJ420 KOMPLEKS WAN KIEN,2026-02,3,0,0,T640,Stesen LRT Taman Jaya ~ Taman Sri Sentosa
T6400,PJ429 IPD PJ,2026-02,7,0,0,T640,Stesen LRT Taman Jaya ~ Taman Sri Sentosa
T6400,PJ430 SEKSYEN 8 (SELATAN),2026-02,5,0,0,T640,Stesen LRT Taman Jaya ~ Taman Sri Sentosa
T6400,PJ435 WISMA MCIS,2026-02,1,1,1,T640,Stesen LRT Taman Jaya ~ Taman Sri Sentosa
T6400,PJ455 MAHKAMAH SYARIAH,2026-02,6,2,0,T640,Stesen LRT Taman Jaya ~ Taman Sri Sentosa
T6400,PJ464 BALAI BOMBA JLN PENCHALA (OPP),2026-02,7,0,0,T640,Stesen LRT Taman Jaya ~ Taman Sri Sentosa
T6400,PJ465 SEKSYEN 51 (UTARA),2026-02,5,0,0,T640,Stesen LRT Taman Jaya ~ Taman Sri Sentosa
T6400,PJ466 SEKSYEN 4,2026-02,7,0,0,T640,Stesen LRT Taman Jaya ~ Taman Sri Sentosa
T6400,PJ468 PASAR PJ OLD TOWN,2026-02,2,0,5,T640,Stesen LRT Taman Jaya ~ Taman Sri Sentosa
T6400,PJ734 TAMAN PETALING UTAMA,2026-02,3,0,0,T640,Stesen LRT Taman Jaya ~ Taman Sri Sentosa
T6400,PJ751 PJ OLD TOWN SEKSYEN 2,2026-02,0,0,3,T640,Stesen LRT Taman Jaya ~ Taman Sri Sentosa
T6400,PJ768 SPG SRI MANJA 5,2026-02,6,0,0,T640,Stesen LRT Taman Jaya ~ Taman Sri Sentosa
T6400,PJ769 SURAU AL-ISLAH (OPP),2026-02,6,0,0,T640,Stesen LRT Taman Jaya ~ Taman Sri Sentosa
T6400,PJ84 PJ WALK,2026-02,1,0,3,T640,Stesen LRT Taman Jaya ~ Taman Sri Sentosa
T7158,"(M) KS1 PUNCAK BESTARI, PUNCAK ALAM",2026-02,1,0,1,T715,UiTM Puncak Alam ~ Bandar Puncak Alam
T7158,(M) KS47 PUNCAK ALAM FASA 2,2026-02,2,0,0,T715,UiTM Puncak Alam ~ Bandar Puncak Alam
T7158,KS10 PUNCAK ALAM FASA 3,2026-02,2,0,0,T715,UiTM Puncak Alam ~ Bandar Puncak Alam
T7158,KS11 PUSAT NIAGA ASTANA,2026-02,2,0,0,T715,UiTM Puncak Alam ~ Bandar Puncak Alam
T7158,KS12 SURAU HAJI ISMAIL (OPP),2026-02,2,0,0,T715,UiTM Puncak Alam ~ Bandar Puncak Alam
T7158,KS2 MASJID PUNCAK ALAM (TIMUR),2026-02,2,0,0,T715,UiTM Puncak Alam ~ Bandar Puncak Alam
T7158,KS33 FAKULTI PENDIDIKAN,2026-02,2,0,1,T715,UiTM Puncak Alam ~ Bandar Puncak Alam
T7158,KS34 FAKULTI FARMASI,2026-02,2,0,0,T715,UiTM Puncak Alam ~ Bandar Puncak Alam
T7158,KS35 PUNCAK ALAM DRIVING RANGE,2026-02,1,0,0,T715,UiTM Puncak Alam ~ Bandar Puncak Alam
T7158,KS355 PUNCAK ALAM FOUNTAIN (TIMUR),2026-02,0,0,2,T715,UiTM Puncak Alam ~ Bandar Puncak Alam
T7158,KS359 PINTU MASUK UITM,2026-02,0,0,2,T715,UiTM Puncak Alam ~ Bandar Puncak Alam
T7158,KS36 PETRONAS PUNCAK ALAM 1 (OPP),2026-02,2,0,0,T715,UiTM Puncak Alam ~ Bandar Puncak Alam
T7158,KS8 LOTUS PUNCAK ALAM (OPP),2026-02,2,0,0,T715,UiTM Puncak Alam ~ Bandar Puncak Alam
T7158,"KS9 KLINIK 1 MALAYSIA, PUNCAK ALAM",2026-02,2,0,0,T715,UiTM Puncak Alam ~ Bandar Puncak Alam
T7538,SA15 TAMAN TASIK SHAH ALAM,2026-02,1,0,4,T753,"Hentian Bandar Shah Alam ~ Sekysen 11, 9, 8, 6, 5"
T7538,SA16 KOMPLEKS PKNS (OPP),2026-02,2,0,0,T753,"Hentian Bandar Shah Alam ~ Sekysen 11, 9, 8, 6, 5"
T7538,SA19 MARDHIYYAH HOTEL & SUITES,2026-02,2,0,0,T753,"Hentian Bandar Shah Alam ~ Sekysen 11, 9, 8, 6, 5"
T7538,SA21 SAMT TENGKU AMPUAN JEMAAH,2026-02,6,0,0,T753,"Hentian Bandar Shah Alam ~ Sekysen 11, 9, 8, 6, 5"
T7538,SA28 PERUMAHAN SEKSYEN 10,2026-02,5,0,0,T753,"Hentian Bandar Shah Alam ~ Sekysen 11, 9, 8, 6, 5"
T7538,SA29 PLAZA SHAH ALAM (OPP),2026-02,5,0,1,T753,"Hentian Bandar Shah Alam ~ Sekysen 11, 9, 8, 6, 5"
T7538,SA30 KUARTERS IPK SELANGOR,2026-02,3,0,1,T753,"Hentian Bandar Shah Alam ~ Sekysen 11, 9, 8, 6, 5"
T7538,SA322 PERUMAHAN JALAN TEPIAN 8,2026-02,5,0,1,T753,"Hentian Bandar Shah Alam ~ Sekysen 11, 9, 8, 6, 5"
T7538,SA323 KOMERSIAL SEKSYEN 8,2026-02,6,0,0,T753,"Hentian Bandar Shah Alam ~ Sekysen 11, 9, 8, 6, 5"
T7538,SA324 PANGSAPURI SEKSYEN 8 (BARAT),2026-02,5,1,0,T753,"Hentian Bandar Shah Alam ~ Sekysen 11, 9, 8, 6, 5"
T7538,SA349 SEKSYEN 6 (UTARA),2026-02,3,0,0,T753,"Hentian Bandar Shah Alam ~ Sekysen 11, 9, 8, 6, 5"
T7538,SA351 PANGSAPURI PKNS SEKSYEN 6 (OPP),2026-02,4,0,0,T753,"Hentian Bandar Shah Alam ~ Sekysen 11, 9, 8, 6, 5"
T7538,SA352 SK BANDAR ANGGERIK (OPP),2026-02,2,0,0,T753,"Hentian Bandar Shah Alam ~ Sekysen 11, 9, 8, 6, 5"
T7538,SA353 KOLEJ CENDANA UITM,2026-02,5,0,0,T753,"Hentian Bandar Shah Alam ~ Sekysen 11, 9, 8, 6, 5"
T7538,SA358 SRA SEKSYEN 3 (OPP),2026-02,3,0,2,T753,"Hentian Bandar Shah Alam ~ Sekysen 11, 9, 8, 6, 5"
T7538,SA361 SK RAJA MUDA,2026-02,4,0,0,T753,"Hentian Bandar Shah Alam ~ Sekysen 11, 9, 8, 6, 5"
T7538,SA367 DATARAN KEMERDEKAAN,2026-02,5,0,1,T753,"Hentian Bandar Shah Alam ~ Sekysen 11, 9, 8, 6, 5"
T7538,SA45 PANGSAPURI PKNS SEKSYEN 8,2026-02,5,0,0,T753,"Hentian Bandar Shah Alam ~ Sekysen 11, 9, 8, 6, 5"
T7538,SA856 WISMA MBSA,2026-02,4,0,0,T753,"Hentian Bandar Shah Alam ~ Sekysen 11, 9, 8, 6, 5"
T7548,SA14 HUB SEKSYEN 2,2026-02,3,0,0,T754,Hentian Bandar Shah Alam ~ Terminal Seksyen 17
T7548,SA15 TAMAN TASIK SHAH ALAM,2026-02,1,0,1,T754,Hentian Bandar Shah Alam ~ Terminal Seksyen 17
T7548,SA16 KOMPLEKS PKNS (OPP),2026-02,1,0,0,T754,Hentian Bandar Shah Alam ~ Terminal Seksyen 17
T7548,SA344 HOTEL UITM,2026-02,3,0,0,T754,Hentian Bandar Shah Alam ~ Terminal Seksyen 17
T7548,SA374 HOTEL UITM (OPP),2026-02,4,0,0,T754,Hentian Bandar Shah Alam ~ Terminal Seksyen 17
T7548,SA560 UITM SEKSYEN 17,2026-02,1,0,0,T754,Hentian Bandar Shah Alam ~ Terminal Seksyen 17
T7548,SA561 ALAM RESIDENTIALS (BARAT),2026-02,2,1,0,T754,Hentian Bandar Shah Alam ~ Terminal Seksyen 17
T7548,SA564 SMK SEKSYEN 16,2026-02,3,0,0,T754,Hentian Bandar Shah Alam ~ Terminal Seksyen 17
T7548,SA565 ALAM D16 (UTARA),2026-02,3,0,0,T754,Hentian Bandar Shah Alam ~ Terminal Seksyen 17
T7548,SA566 PASAR MBSA SEKSYEN 16 (OPP),2026-02,2,0,0,T754,Hentian Bandar Shah Alam ~ Terminal Seksyen 17
T7548,SA569 PANGSAPURI ANGGERIK INDAH,2026-02,3,0,0,T754,Hentian Bandar Shah Alam ~ Terminal Seksyen 17
T7548,SA570 DEPOH BAS CITYLINER,2026-02,3,0,0,T754,Hentian Bandar Shah Alam ~ Terminal Seksyen 17
T7548,SA571 DEPOH BAS CITYLINER (OPP),2026-02,3,0,1,T754,Hentian Bandar Shah Alam ~ Terminal Seksyen 17
T7548,SA574 PANGSAPURI ANGGERIK INDAH (OPP),2026-02,5,0,0,T754,Hentian Bandar Shah Alam ~ Terminal Seksyen 17
T7548,SA577 PASAR MBSA SEKSYEN 16,2026-02,5,0,0,T754,Hentian Bandar Shah Alam ~ Terminal Seksyen 17
T7548,SA578 ALAM D16 (UTARA),2026-02,5,0,0,T754,Hentian Bandar Shah Alam ~ Terminal Seksyen 17
T7548,SA579 SMK SEKSYEN 16 (OPP),2026-02,4,0,0,T754,Hentian Bandar Shah Alam ~ Terminal Seksyen 17
T7548,SA580 ALAM RESIDENTIALS (BARAT),2026-02,3,0,0,T754,Hentian Bandar Shah Alam ~ Terminal Seksyen 17
T7548,SA589 UITM SEKSYEN 17,2026-02,5,0,0,T754,Hentian Bandar Shah Alam ~ Terminal Seksyen 17
T7548,SA6 SIRIM,2026-02,2,0,0,T754,Hentian Bandar Shah Alam ~ Terminal Seksyen 17
T7548,SA7 HUB SEKSYEN 2,2026-02,4,0,0,T754,Hentian Bandar Shah Alam ~ Terminal Seksyen 17
T7548,SA854 KOMPLEKS PKNS SHAH ALAM,2026-02,3,0,0,T754,Hentian Bandar Shah Alam ~ Terminal Seksyen 17
T7548,SA855 WISMA MBSA (OPP),2026-02,0,1,0,T754,Hentian Bandar Shah Alam ~ Terminal Seksyen 17
T7548,SA856 WISMA MBSA,2026-02,2,0,0,T754,Hentian Bandar Shah Alam ~ Terminal Seksyen 17
T7548,SA967 SMK SEKSYEN 2,2026-02,4,0,0,T754,Hentian Bandar Shah Alam ~ Terminal Seksyen 17
T7548,SA968 SMK SEKYEN 2 (OPP),2026-02,3,0,0,T754,Hentian Bandar Shah Alam ~ Terminal Seksyen 17
T7548,TERMINAL SEKSYEN 17,2026-02,4,0,0,T754,Hentian Bandar Shah Alam ~ Terminal Seksyen 17
T7568,GAMUDA WALK MALL,2026-02,2,0,0,T756,Kemuning Business Park ~ Hentian Bandar via Taman Muda
T7568,SA1 LOTUS EXTRA SHAH ALAM (OPP),2026-02,3,0,0,T756,Kemuning Business Park ~ Hentian Bandar via Taman Muda
T7568,SA18 WISMA PKPS,2026-02,4,0,0,T756,Kemuning Business Park ~ Hentian Bandar via Taman Muda
T7568,SA2 BULATAN KAYANGAN,2026-02,3,0,1,T756,Kemuning Business Park ~ Hentian Bandar via Taman Muda
T7568,SA218 CANAL GARDEN,2026-02,2,0,0,T756,Kemuning Business Park ~ Hentian Bandar via Taman Muda
T7568,SA223 CHINESE TAIPEI SCHOOL KL,2026-02,2,0,0,T756,Kemuning Business Park ~ Hentian Bandar via Taman Muda
